{
  "$schema": "https://json-schema.org/draft/2020-12/schema",
  "title": "GameStats event envelope v1",
  "description": "Estructura común a todos los eventos de todos los juegos. Las reglas por tipo de evento viven en schemas/games/<gameId>.v1.schema.json. El productor no puede enviar campos fuera de este sobre (en particular 'ingest', que agrega Go).",
  "$ref": "#/$defs/EventCore",
  "unevaluatedProperties": false,
  "$defs": {
    "EventCore": {
      "type": "object",
      "required": ["eventId", "timestamp", "gameId", "gameVersion", "matchId", "type", "data"],
      "properties": {
        "eventId": {
          "type": "string",
          "pattern": "^[A-Za-z0-9._:-]{1,64}$",
          "description": "Identificador del evento. Único dentro de la partida (se recomienda único global). Clave de idempotencia."
        },
        "timestamp": { "$ref": "#/$defs/UtcTimestamp" },
        "gameId": {
          "type": "string",
          "pattern": "^[a-z0-9-]{2,32}$",
          "description": "Juego registrado (p. ej. arena-combat)."
        },
        "gameVersion": {
          "type": "string",
          "pattern": "^[0-9]+\\.[0-9]+$",
          "description": "Versión del juego que produjo el evento (MAYOR.MENOR)."
        },
        "matchId": {
          "type": "string",
          "pattern": "^[A-Za-z0-9._-]{1,64}$",
          "description": "Partida. La identidad de una partida es el par (gameId, matchId)."
        },
        "playerId": {
          "$ref": "#/$defs/PlayerId",
          "description": "Jugador que origina el evento. Requerido en eventos de jugador; prohibido en eventos globales (MATCH_STARTED, MATCH_FINISHED)."
        },
        "type": {
          "type": "string",
          "pattern": "^[A-Z][A-Z_]{2,40}$",
          "description": "Tipo de evento. Debe pertenecer al catálogo del juego."
        },
        "seq": {
          "type": "integer",
          "minimum": 0,
          "description": "Opcional. Secuencia del productor dentro de la partida; desempata eventos con el mismo timestamp."
        },
        "data": {
          "type": "object",
          "description": "Carga específica del tipo de evento."
        }
      }
    },
    "UtcTimestamp": {
      "type": "string",
      "format": "date-time",
      "pattern": "^[0-9]{4}-[0-9]{2}-[0-9]{2}T[0-9]{2}:[0-9]{2}:[0-9]{2}(\\.[0-9]{1,3})?Z$",
      "description": "ISO 8601 en UTC con sufijo Z, precisión máxima de milisegundos."
    },
    "PlayerId": {
      "type": "string",
      "pattern": "^[A-Za-z0-9._-]{1,64}$"
    },
    "Forbidden": {
      "description": "El campo no debe estar presente (p. ej. playerId en eventos globales).",
      "not": {}
    },
    "EmptyData": {
      "type": "object",
      "additionalProperties": false
    },
    "PlayerLeftData": {
      "type": "object",
      "required": ["reason"],
      "additionalProperties": false,
      "properties": {
        "reason": { "enum": ["DISCONNECT", "QUIT"] }
      }
    },
    "MatchFinishedData": {
      "type": "object",
      "required": ["reason"],
      "additionalProperties": false,
      "properties": {
        "reason": { "enum": ["COMPLETED", "ABORTED"] }
      }
    }
  }
}
