{
  "eventId": "ex1-e04",
  "timestamp": "2026-10-01T15:00:11.250Z",
  "gameId": "arena-combat",
  "gameVersion": "1.0",
  "matchId": "match-ex1",
  "playerId": "p1",
  "type": "ATTACK",
  "seq": 4,
  "data": {
    "targetPlayerId": "p2",
    "weapon": "rifle",
    "hit": false,
    "damage": 0
  }
}
